Source,Name,Description
Wikipedia,Geastrum pectinatum,"Geastrum pectinatum is an inedible species of mushroom belonging to the earthstar family of fungi. Although young specimens are spherical, fruit body development involves the outer layer of tissue splitting open like a star into 7 to 10 pointed rays that eventually bend back to point downward, revealing a small – 1 to 2.5 cm (1⁄2 to 1 in) broad – spore sac. The spore sac is supported by a small radially wrinkled stalk.  There is a distinct conical opening (peristome) at the top of the spore sac "
First Nature,Geastrum triplex,"Phylum: Basidiomycota - Class: Agaricomycetes - Order: Geastrales - Family: Geastraceae
Distribution - Taxonomic History - Etymology - Identification - Culinary Notes - Reference Sources

Look in woodland for this member of the (hopelessly jumbled, taxonomically, but useful from an identification point of view) gastromycetes group of fungi. Collared Earthstars are most often found under hardwood trees, but we have also found them in coniferous woodland, particularly with firs and spruces.

If yo"
Wikipedia,Geastrum triplex,"Geastrum triplex is a fungus found in the detritus and leaf litter of hardwood forests around the world. It is commonly known as the collared earthstar, the saucered earthstar, or the triple earthstar—and less commonly by the alternative species name Geastrum indicum. It is the largest member of the genus Geastrum (or earthstar fungi) and expanded mature specimens can reach a tip-to-tip length of up to 12 centimeters (4+3⁄4 in).
Immature fruit bodies are spherical—somewhat resembling puffballs w"
Mushroom Expert,Geastrum triplex,"Ecology:Saprobic; growing alone or gregariously under hardwoods; summer and fall (over winter in warmer climates); widely distributed in North America.
Fruiting Body: At first a smooth, egg-shaped ball with a prominent pointed beak, 1-5 cm wide, attached to the substrate by a point at the base; with maturity the outer skin peeling back to form 4-8 more or less triangular, buff colored, non-hygroscopic arms that are thick and usually develop fissures and cracks, frequently splitting to form a saucer; spore case more or less round, smooth, brownish, with a fuzzy conical beak that is often surrounded by a pale area; 5-10 cm across when arms are opened; interior of spore case initially solid and white but soon powdery and brown.
Microscopic Features: Spores 3.5-4.5 µ; round; spiny; brownish to cinnamon in KOH. Capillitial threads 3-6 µ wide; yellowish in KOH; incrusted."
First Nature,Hexagonia hydnoides,"The page you have requested does not exist, or it may have been renamed or moved...
...but we might still be able to help:
A message about this problem has been sent to the webmaster, and if we can fix it so that things go more smoothly in future then we certainly will. We are sorry for any inconvenience and grateful for your patience.
Email Us..."
Wikipedia,Hexagonia hydnoides,"Hexagonia hydnoides, also known as the hairy hexagonia, is a widely distributed species of bracket fungus in the Polyporaceae family. The name comes from the species' distinctive dark hairy bristles found on the cap - hydnoides meaning 'relating to Hydnum,' a genus of toothed fungi. In general, it is known to grow in tropical regions across the globe and to grow on dead wood tissues, particularly that of hardwoods. It is a plant pathogen. This fungus is largely saprophytic, decaying dead wood ti"
Mushroom Expert,Hexagonia hydnoides,"Ecology:Saprobic; growing alone or gregariously on the deadwood of hardwoods; causing a white rot; appearing year-round; widely distributed from the southern United States through South America. The illustrated and described collection is from southern Missouri.
Cap: 5–10 cm across; 4–7 cm deep; thin; irregularly semicircular; convex or nearly flat; densely hairy with dark brown to black hairs (but reportedly sometimes losing the hairs and becoming more or less bald with old age); faintly zoned, especially toward the margin; surface underneath hairs brown to dark brown.
Pore Surface: Brown to dark brown; not bruising; with 3–4 slightly angular pores per mm; tubes 2–6 mm deep.
Stem: Absent.
Flesh: Rusty brown; not changing when sliced.
Odor: Not distinctive.
Chemical Reactions: KOH black on flesh and tubes.
Spore Print: Not documented.
Microscopic Features: Spores not found in the collection examined; reported by Gilbertson & Ryvarden (1986) as ""cylindrical, hyaline and thin-walled, 11–14.5 x 3.5–5 µm."" Setae, cystidia not found. Hyphal system trimitic. Clamp connections present in generative hyphae."
First Nature,Hypholoma fasciculare,"Phylum: Basidiomycota - Class: Agaricomycetes - Order: Agaricales - Family: Strophariaceae
Distribution - Taxonomic History - Etymology - Toxicity - Poisoning - Identification - Reference Sources

From April through to the first heavy frosts, a walk in mixed woodland rarely fails to reveal Sulphur Tufts fruiting on fallen trees, decaying stumps or, occasionally, hollow trunks of living trees.
This wood-rotting fungus is not a fussy feeder it tackles deciduous hardwoods as well as conifers appare"
Wikipedia,Hypholoma fasciculare,"Hypholoma fasciculare, commonly known as the sulphur tuft or clustered woodlover,  is a common woodland mushroom, often in evidence when hardly any other mushrooms are to be found. This saprotrophic small gill fungus grows prolifically in large clumps on stumps, dead roots or rotting trunks of broadleaved trees.
The ""sulphur tuft"" is bitter and poisonous; consuming it can cause vomiting, diarrhea and convulsions. The toxins are steroids known as fasciculols and have been shown to be calmodulin i"
Mushroom Expert,Hypholoma fasciculare,"Ecology:Saprobic; growing in clusters on decaying logs and stumps of conifers and, rarely, hardwoods; fall and winter, sometimes in spring; widely distributed in North America, but more common along the West Coast and in montane or northern areas. The illustrated and described collections are from California, Colorado, and Illinois.
Cap: 2-5 cm; convex, becoming broadly convex or nearly flat; bald; dry; when young often tawny reddish brown or orange, but usually becoming bright yellow to greenish yellow or golden yellow, with a darker center; the margin often featuring small, wispypartial veilfragments.
Gills: Attached to the stem or pulling away from it; close or crowded; yellow, becoming olive or greenish yellow, and eventually dusted with spores and therefore spotted purplish brown to blackish; short-gills frequent.
Stem: 3-10 cm long; 4-10 mm thick; more or less equal, or tapering to base; bright yellow to tawny; developing rusty brown stains from the base upwards; a bright yellowcortinapresent in buttons, but soon disappearing or leaving a faintring zone.
Flesh: Thin, yellow.
Odor and Taste: Odor not distinctive; taste bitter.
Spore Print: Purple brown.
Microscopic Features: Spores: 5-8 x 3-4.5 µ; ellipsoid; smooth; thin-walled; with a pore; yellowish in KOH. Pleuro-chrysocystidia fusoid-ventricose to mucronate; to 40 x 10 µ. Pileipellis a cutis or ixocutis; elements encrusted."
First Nature,Irpex lacteus,"The page you have requested does not exist, or it may have been renamed or moved...
...but we might still be able to help:
A message about this problem has been sent to the webmaster, and if we can fix it so that things go more smoothly in future then we certainly will. We are sorry for any inconvenience and grateful for your patience.
Email Us..."
Wikipedia,Irpex lacteus,"Irpex lacteus is a common crust fungus distributed throughout temperate areas of the world. It is the type of the genus Irpex. Irpex lacteus is considered a polypore, but depending on growth conditions it can also produce a hydnoid hymenophore. Due to this variability and abundance of the species it has been described as a new species to science numerous times and subsequently has an extensive synonymy. The complete genome sequence of Irpex lacteus was reported in 2017.
Irpex lacteus is a white-"
Mushroom Expert,Irpex lacteus,"Ecology:Saprobic; spreading across the bottoms and sides of fallen hardwood logs (occasionally on the wood of conifers); annual; causing a white rot of the sapwood and rarely the heartwood; occasionally reported asparasiticon the living wood of cherry trees; appearing year-round; widely distributed in North America but rare or absent in the Southwest.
Fruiting Body: A spreading patch of whitish pore surface with 2-3 pores per mm, soon becoming tooth-like rather than poroid, except near the margin; developing shelflike edges or even caps when growing on the sides of logs; caps when present kidney-shaped to irregular, with a whitish to grayish (often zoned), velvety to hairy upper surface; flesh thin, whitish, and tough; without a stem.
Chemical Reactions: All parts brownish orange with KOH.
Spore Print: White.
Microscopic Features: Spores 5-7 x 2-3 µ; smooth; elliptical to subcylindric; hyaline in KOH; inamyloid. Cystidia conspicuous; abundant to scattered; 50-110 x 5-10 µ; encrusted apically or over nearly the whole length. Thin-walled generative hyphae frequently branching; 2-4 µ wide. Thick-walled skeletal hyphae rarely branching; 2.5-6 µ wide. Clamp connections absent."
First Nature,Kretzschmaria deusta,"Phylum: Ascomycota - Class: Sordariomycetes - Order: Xylariales - Family: Xylariaceae
Distribution - Taxonomic History - Etymology - Identification - Reference Sources

Kretzschmaria deusta, commonly called the Brittle Cinder fungus, is a seriously worrying plant pathogen, as the many articles in forestry publications confirm. This ascomycete causes soft rot by consuming both cellulose and lignin.
Brittle Cinder fungus is common throughout Britain and Ireland. It can also be found in most temper"
Wikipedia,Kretzschmaria deusta,"Kretzschmaria deusta, commonly known as brittle cinder, is a fungus and plant pathogen found in temperate regions."
Mushroom Expert,Kretzschmaria deusta,"Ecology:Saprobicon the living or dead wood of hardwoods; causing a white rot; often found at the bases of trees; spring through fall; common and widely distributed east of the Rocky Mountains. The illustrated and described collections are from Illinois.
Springtime, Asexual Stage: Spreading in patches 2–9 cm across, irregular in outline; surface dull gray and dusty; dust rubbing off easily to expose a brownish, bumpy surface; white and smooth along the margin; 1–2 mm thick; flesh tough, watery whitish to brownish, developing embedded black dots; with a thin black line just under the upper surface.
Summertime, Sexual Stage: Surface black, hard, bumpy, and lumpy, forming a crust over a cavity of whitish, powdery flesh that disintegrates to create a hollow structure.
Odor: Not distinctive.
Chemical Reactions: KOH on surface negative.
Microscopic Features: Conidia 4–7.5 x 2–3 µm; subfusiform to elongated-lacrymoid; smooth; hyaline in KOH; produced on cylindric elements 25–45 x 2–4 µm. Spores 30–32 x 8–9 µm; fusiform; with a pale, longitudinal germ slit that does not extend to the ends of the spore; smooth; very dark brown to black in KOH."
First Nature,Laetiporus gilbertsonii,"The page you have requested does not exist, or it may have been renamed or moved...
...but we might still be able to help:
A message about this problem has been sent to the webmaster, and if we can fix it so that things go more smoothly in future then we certainly will. We are sorry for any inconvenience and grateful for your patience.
Email Us..."
Wikipedia,Laetiporus gilbertsonii,"Laetiporus gilbertsonii is a species of polypore fungus in the family Fomitopsidaceae. It is found in western North America and South America. It was one of three new Laetiporus species published in 2001, which were distinguished genetically from the common Laetiporus sulphureus; the others were L. conifericola and L. huroniensis. The type collection, made in San Francisco's Golden Gate Park in 1997, was found fruiting on a eucalyptus tree. It has also been collected in Oregon and Washington. Th"
Mushroom Expert,Laetiporus gilbertsonii,"Ecology:Parasiticandsaprobicon living and dead oaks andeucalyptustrees; causing abrown rotof the heartwood; growing alone or gregariously on wood above the ground; fall and winter; distributed along the West Coast and in the southwestern United States, as well as western Mexico. The illustrated and described collection is from California.
Fruiting Body: Up to 20 cm across; usually consisting of several to many shelving caps.
Caps: 6–14 cm across; 4–10 cm deep; up to 2 cm thick; fan-shaped to semicircular; finely suedelike; bright to pale yellow or orangish yellow, with concentric bands of alternating shades of color; fading in maturity and with direct sunlight; the margin bright yellow when fresh whitish.
Pore Surface: Yellow; not bruising; with 2–3 circular to angular pores per mm; tubes to 5 mm deep.
Stem: Usually absent; when present poorly defined, yellowish, and tough.
Flesh: Thick; soft and watery when young, becoming chalky with age; yellowish to whitish; not changing when sliced.
Odor and Taste: Not distinctive.
Microscopic Features:Spores4–6 x 3–4 µm; broadly ellipsoid; smooth; hyaline inKOH;inamyloid. Hymenialcystidianot found.Hyphal systemdimitic. Contextual binding hyphae 5–15 µm wide; often branching; aseptate; smooth; walls 0.5–1.5 µm thick; hyaline in KOH. Hymenial trama generative hyphae 3.5–4.5 µm wide; tubular and unbranched; usually parallel; septate; smooth; thin-walled; hyaline in KOH.Clamp connectionsnot found."
First Nature,Laxitextum bicolor,"The page you have requested does not exist, or it may have been renamed or moved...
...but we might still be able to help:
A message about this problem has been sent to the webmaster, and if we can fix it so that things go more smoothly in future then we certainly will. We are sorry for any inconvenience and grateful for your patience.
Email Us..."
Wikipedia,Laxitextum bicolor,Laxitextum bicolor is a plant pathogen fungus. It is inedible.
First Nature,Lentinus crinitus,"The page you have requested does not exist, or it may have been renamed or moved...
...but we might still be able to help:
A message about this problem has been sent to the webmaster, and if we can fix it so that things go more smoothly in future then we certainly will. We are sorry for any inconvenience and grateful for your patience.
Email Us..."
Wikipedia,Lentinus crinitus,"Lentinus crinitus is a basidiomycete in Agaricomycotina. It is in the order Polyporales and in the family Polyporaceae, within the group Polyporellus. There are many synonyms including Agaricus essequeboensis, Lentinus chaetoloma, Lentinus essequeboensis, Lentinus microloma, Lentinus rigidulus, Lentinus subcervinus, Curtis, Lentinus wrightii, Panus crinitus, Panus wrightii, Polyporus phyllostipes, and Agaricus crinitus.  The common name is The Fringed Sawgill.
This fungus was first described by "
First Nature,Lepista nuda,"Phylum: Basidiomycota - Class: Agaricomycetes - Order: Agaricales - Family: Tricholomataceae
Distribution - Taxonomic History - Etymology - Identification - Culinary Notes - Reference Sources

Lepista nuda, the Wood Blewit, grows in leaf litter in deciduous and mixed woodland and under hedgerows during autumn and winter, often fruiting well into December during mild weather.
Wood Blewits are bluish... at least when they are young. The caps, gills and stems are actually more of a violet colour, b"
Wikipedia,Lepista nuda,"Collybia nuda, commonly known as the blewit or wood blewit and previously described as Lepista nuda and Clitocybe nuda, is an edible mushroom native to Europe and North America. Described by Pierre Bulliard in 1790, it was also known as Tricholoma nudum for many years. It is found in both coniferous and deciduous woodlands. It is a fairly distinctive mushroom that is widely eaten. It has been cultivated in Britain, the Netherlands and France. This species was reassigned to the genus Collybia in "
First Nature,Panaeolus antillarum,"The page you have requested does not exist, or it may have been renamed or moved...
...but we might still be able to help:
A message about this problem has been sent to the webmaster, and if we can fix it so that things go more smoothly in future then we certainly will. We are sorry for any inconvenience and grateful for your patience.
Email Us..."
Wikipedia,Panaeolus antillarum,"Panaeolus antillarum is a species of mushroom in the family Bolbitiaceae. It is edible but not commonly eaten. It is found from northern North America through Mexico into northern South America.
It is often mistaken for Panaeolus semiovatus var. phalaenarum or Panaeolus cyanescens, the latter species can be distinguished by the thinner, grayer cap and blue bruising."
First Nature,Phlebia radiata,"Phylum: Basidiomycota - Class: Agaricomycetes - Order: Polyporales (insertae sedis) - Family: Meruliaceae
Distribution - Taxonomic History - Etymology - Identification - Culinary Notes - Reference Sources

A wood-rotting crust fungus of fallen trunks and branches from deciduous hardwoods and occasionally conifers, this attractive species produces its spores on the wrinkled outer surface. Wrinkled Crust is very common in Britain and Ireland.

The specimens shown above are young and pale; with age"
Wikipedia,Phlebia radiata,"Phlebia radiata, commonly known as the wrinkled crust, is a common species of crust fungus in the family Meruliaceae. It is widespread in the Northern Hemisphere. It grows as a wrinkled, orange to pinkish waxy crust on the decaying wood of coniferous and deciduous trees, in which it causes a white rot. The fungus was first described scientifically in 1821 by Elias Magnus Fries."
Mushroom Expert,Phlebia radiata,"Ecology:Saprobic; spreading across logs and stumps of hardwoods or conifers; annual; causing a white rot; spring, summer, fall, and winter; widely distributed in North America.
Fruiting Body: 1-10 cm or more across; irregular in outline; up to about 3 mm thick; surface wrinkled, with the wrinkles and folds radiating from a more or less central point; orange to pink (more rarely tan with orangish edges, or purplish); occasionally developing a slightly folded-over, hairy edge.
Spore Print: White.
Microscopic Features: Spores 4-5.5 x 1.5-2 µ; smooth; sausage-shaped; inamyloid. Cystidia cylindric to clavate; up to about100 x 10 µ.Clamp connections present."
First Nature,Pleurotus djamor,"The page you have requested does not exist, or it may have been renamed or moved...
...but we might still be able to help:
A message about this problem has been sent to the webmaster, and if we can fix it so that things go more smoothly in future then we certainly will. We are sorry for any inconvenience and grateful for your patience.
Email Us..."
Wikipedia,Pleurotus djamor,"Pleurotus djamor, commonly known as the pink oyster mushroom, is a species of fungus in the family Pleurotaceae."
First Nature,Pseudohydnum gelatinosum,"Phylum: Basidiomycota - Class: Tremellomycetes - Order: Auriculariales - Family: Insertae sedis (not yet determined)
Distribution - Taxonomic History - Etymology - Identification - Culinary Notes - Reference Sources

Pseudohydnum gelatinosum is variously referred to as the Toothed Jelly Fungus, the False Hedgehog Fungus, or the White Jelly Mushroom. This rather strange fungus occurs on well-rotted coniferous wood, most commonly on spruce varieties.
The underside of this jelly fungus - a member o"
Wikipedia,Pseudohydnum gelatinosum,"Pseudohydnum gelatinosum, commonly known as the toothed jelly fungus, cat's tongue, or jelly tooth, is an Eurasian species of fungus in the order Auriculariales. Its common names refer to its gelatinous consistency and hydnoid (toothed) undersurface."
Mushroom Expert,Pseudohydnum gelatinosum,"Ecology:Saprobicon the wood or woody debris of conifers, causing awhite rot; sometimes growing from standing trees; growing alone, scattered, or gregariously; late summer and fall, or fall and winter in warmer climates; originally described from Slovenia; widely distributed in Europe, North America, Central America, the Caribbean, South America, Asia, and Oceania. The illustrated and described collections are from California and Michigan.
Cap: 2.5–5.5 cm across; tongue-shaped or kidney-shaped; broadly convex or flat; gelatinous but not slimy to the touch; smooth or finely fuzzy; translucent white to grayish, brown, or fairly dark brown; the margin tucked under when young.
Undersurface: Running down the stem; spines to 2 mm long; translucent white or pale grayish.
Stem: To 3 cm long; either lateral and stubby (when specimens are growing from the sides of logs) or well-developed and vertical (when specimens are growing from the tops of logs or from terrestrial woody debris); gelatinous; smooth; colored like the cap or paler.
Flesh: Translucent; gelatinous.
Odor: Not distinctive.
Spore Print: White.
Microscopic Features:Spores6–7 x 5–7  µm; subglobose to very broadly ellipsoid; smooth; hyaline inKOH; germinating by repetition. Probasidia 25 x 6 µm; clavate.Basidia10–12 x 10–20 µm; subglobose/clavate; cruciate-septate; with 2 or 4 sterigmata 5–12 µm long.Hyphae2–3 µm wide; smooth; hyaline in KOH;clampedat septa."
First Nature,Pycnoporus sanguineus,"The page you have requested does not exist, or it may have been renamed or moved...
...but we might still be able to help:
A message about this problem has been sent to the webmaster, and if we can fix it so that things go more smoothly in future then we certainly will. We are sorry for any inconvenience and grateful for your patience.
Email Us..."
Wikipedia,Pycnoporus sanguineus,"Pycnoporus sanguineus is a white rot saprobic fungus. It was discovered on Guana Island (part of the Virgin Islands) but occurs throughout the tropics and subtropics, usually growing on dead hardwoods.  It grows in the form of a thin dry conk with a lateral attachment to its substrate, or sometimes a very short stipe. The cap is orange-red to orange, lightening to salmon/buff in age. It has concentric zonation, and is finely tomentose to nearly glabrous. The pores on the underside are round, mea"
First Nature,Rigidoporus ulmarius,"The page you have requested does not exist, or it may have been renamed or moved...
...but we might still be able to help:
A message about this problem has been sent to the webmaster, and if we can fix it so that things go more smoothly in future then we certainly will. We are sorry for any inconvenience and grateful for your patience.
Email Us..."
Wikipedia,Rigidoporus ulmarius,"Rigidoporus ulmarius is a fungal plant pathogen found mainly on broad-leaved trees. Elm is considered particularly susceptible.
The fruiting bodies are white, knobbly and relatively hard, requiring a fair amount of force to break. Older bodies may be covered with green algae, or partially covered with vegetation and leaves making them difficult to spot. They often encapsulate grass, twigs and other debris.
Tubes are 1–5 mm long in each layer, pinkish to orange when young, browning with age, each"
First Nature,Schizophyllum commune,"Phylum: Basidiomycota - Class: Agaricomycetes - Order: Agaricales - Family: Schizophyllaceae
Distribution - Taxonomic History - Etymology - Identification - Culinary Notes - Reference Sources

Often seen on sickly hardwood trees, but equally common on dead wood including cut timber, the Split Gill fungus usually grows as a sessile bracket. On the undersides of branches, however, it more often forms centrally-attached circular fans, as shown on the left, below.
Seen from above, this is just anoth"
Wikipedia,Schizophyllum commune,"Schizophyllum commune is a species of fungus in the genus Schizophyllum. The mushroom resembles undulating waves of tightly packed corals or a loose Chinese fan. Gillies or split-gills vary from creamy yellow to pale white in colour. The cap is small, 1–4 centimetres (3⁄8–1+5⁄8 in) wide with a dense yet spongey body texture. It is known as the split-gill mushroom because of the unique, longitudinally divided nature of the namesake gills on the underside of the cap. This mushroom is found through"
Mushroom Expert,Schizophyllum commune,"Ecology:Saprobicon deadwood or occasionallyparasiticon living wood; growing alone or, more frequently, gregariously to clustered; on decaying hardwood sticks and logs (even on planks and boards); year-round (it survives by shriveling up and waiting for more moisture); originally described and named from Sweden; widely distributed in North America and throughout the world. The illustrated and described collections are from Illinois, Indiana, and Kentucky.
Cap: 1–4 cm across; fan-shaped when attached to the side of the log; irregular to shell-shaped when attached above or below; finely hairy to velvety or almost granular; dry; whitish to grayish or brownish; sometimes developing concentric textural zones.
Gills: Distant; folded together and appearing split down the middle; whitish to grayish."
First Nature,Scleroderma citrinum,"Phylum: Basidiomycota - Class: Agaricomycetes - Order: Boletales - Family: Sclerodermataceae
Distribution - Taxonomic History - Etymology - Identification - Toxicity - Reference Sources

Scleroderma citrinum, the Common Earthball, is similar in appearance to a warty potato. Acid soils, especially on the compacted paths in forests, are its main habitat. The colour of these probably poisonous members of the (artificial rather than taxonomically-related) group of fungi known as gasteromycetes or st"
