Source,Name,Description
Wikipedia,Scleroderma citrinum,"Scleroderma citrinum, commonly known as the common earthball, pigskin poison puffball, or common earth ball, is a species of earthball fungus found in Europe and in North America. It is the most common species of earthball fungus in the UK and occurs widely in woods, heathland and in short grass from autumn to winter. Scleroderma citrinum has two synonyms, Scleroderma aurantium (Vaill.) and Scleroderma vulgare Horn.
Earthballs are superficially similar to, and considered look-alikes of, the edib"
Mushroom Expert,Scleroderma citrinum,"Ecology:Mycorrhizalwith hardwoods and conifers; often found in mossy areas (occasionally on well-rotted wood); growing alone, scattered, or gregariously; widely distributed; summer and fall.
Fruiting Body: 2-10 cm across; round or flattened; the surface hard and scaly, yellowish to yellow-brown, often cracked; the ""skin"" whitish when sliced but blushing pinkish; sometimes gathered at the base, wheremycelial strandsmay be found.
Spore Mass: Thick and white at first, becoming purple to purple-black from the center outwards; eventually blackish to brownish and dust-like.
Chemical Reactions: Surface dark reddish with KOH.
Microscopic Features: Spores 8-13 µ; round; prominentlyreticulate."
First Nature,Sparassis crispa,"Phylum: Basidiomycota - Class: Agaricomycetes - Order: Polyporales - Family: Sparassidaceae
Distribution - Taxonomic History - Etymology - Identification - Culinary Notes - Reference Sources

This massive fungus, sometimes several attaining a weight of several kg, grows at the bases of pine trees and occasionally other softwoods in summer and autumn. Commonly referred to as the Wood Cauliflower, this really is an impressive fungus.
Although in the wild these fungi are parasitic on the roots of c"
Wikipedia,Sparassis crispa,Sparassis crispa is a species of fungus in the family Sparassidaceae. It is sometimes called cauliflower fungus.
First Nature,Stereum hirsutum,"Phylum: Basidiomycota - Class: Agaricomycetes - Order: Russulales - Family: Stereaceae
Distribution - Taxonomic History - Etymology - Identification - Culinary Notes - Reference Sources

No matter how many of these attractve bracket fungi you see, there will always be another Stereum hirsutum with significantly different coloration. The variability of this fungus makes its identification at first rather difficult.
Stereum hirsutum is common and widespread throughout Britain and Ireland. On mainl"
Wikipedia,Stereum hirsutum,"Stereum hirsutum, commonly known as the false turkey tail, hairy stereum, or hairy curtain crust, is a species of fungus and a plant pathogen that infects coniferous and deciduous trees."
Mushroom Expert,Stereum hirsutum,"Ecology:Saprobicon the dead wood of hardwoods, especially oaks; growing densely gregariously, often from gaps in the bark, fusing together laterally; causing a white rot of the heartwood; often serving as a host to algae; sometimes parasitized byjelly fungi; spring, summer, fall, and winter; widely distributed in North America.
Fruiting Body: Individually .5-3 cm across, but often fused together; fan-shaped, semicircular, or irregular; densely velvety, hairy, or with appressed hairs; with concentric zones of texture and color; colors variable, but generally ranging from yellow to tan, brown, reddish brown, or buff (sometimes developing greenish shades in old age as a result of algae); laterally attached, without a stem.
Undersurface: Smooth; yellowish to yellow-brown or grayish brown; sometimes bruising darker yellow.
Flesh: Insubstantial; tough.
Chemical Reactions: KOH red (or at first red, then black) on all surfaces.
Spore Print: White; difficult to obtain.
Microscopic Features: Spores 5-8 x 2-3.5 µ; smooth; cylindric or narrowly elliptical; amyloid. Hyphidia with rounded to subacute apices; without projections (pseudoacanthohyphidia and acanthohyphidia absent)."
First Nature,Stropharia rugosoannulata,"Phylum: Basidiomycota - Class: Agaricomycetes - Order: Agaricales - Family: Strophariaceae
Distribution - Taxonomic History - Etymology - Identification - Culinary Notes - Reference Sources

The Wine Roundhead is a large and very distinctive mushroom, at least when young and fresh. Unfortunately, the red-wine colouring of the caps soon fades to brown and eventually almost white in dry weather. making it more difficult to distinguish this roundhead mushroom from other dull-looking mushrooms of si"
Wikipedia,Stropharia rugosoannulata,"Stropharia rugosoannulata, commonly known as the wine cap stropharia, ""garden giant"", burgundy mushroom, king stropharia, or wine-red stropharia, is a species of agaric mushroom in the family Strophariaceae native to Europe and North America.
Unlike many other members of the genus Stropharia, it is regarded as a choice edible and is commercially cultivated."
Mushroom Expert,Stropharia rugosoannulata,"Ecology:Saprobic; growing scattered or gregariously (sometimes in clusters); usually found on woodchips, in gardens, and in other cultivated areas, but sometimes collected along stream beds where spring floods have occurred; spring through fall; in North America widespread and fairly common east of the Great Plains, and occasionally reported in Washington and British Columbia. The illustrated and described collections are from Pennsylvania, Massachusetts, and Illinois.
Cap: 4–13 cm; convex at first, becoming broadly convex to nearly flat; sticky when fresh, but soon glossy and dry; bald; wine red to reddish brown, fading to yellowish brown or yellowish; sometimes developing cracks in old age; the margin sometimes hung with raggedpartial veilremnants.
Gills: Attached to the stem; close or nearly crowded; short-gills frequent; whitish to pale gray at first, becoming purplish gray to purple-black.
Stem: 8–16 cm long; 1–2 cm thick; equal, or with an enlarged base; dry; bald or finely hairy; white, discoloring yellowish to brownish in age; usually featuring a thick, white to yellowishringthat is finely grooved on its upper surface (and often blackened by spores) and radially split or ""cogwheeled"" on its underside; base with whitemycelial threads.
Flesh: White; firm; unchanging when sliced.
Odor and Taste: Not distinctive.
Spore Print: Dark purple-brown to purplish black.
Chemical Reactions: KOH on cap surface olive green.
Microscopic Features: Spores 11–15 x 7–9 µm; ellipsoid, with one end slightly truncated for a large pore measuring 1-2 µm across; smooth; thick-walled; yellow-brown in KOH. Basidia 4-sterigmate. Cheilocystidia dimorphic: either 25–45 x 7.5–15 µm, fusoid-ventricose, often becoming rostrate, thin-walled, smooth, hyaline in KOH, often but not always developing globular, refractive inclusions and becoming chrysocystidia—or 35–50 x 12.5–15 µm, widely cylindric to subutriform, thin-walled, smooth (leptocystidia). Pleurocystidia similar to chryso-cheilocystidia. Pileipellis a slightly gelatinized cutis of elements 5–15 µm wide; elements smooth, hyaline to orangish brown in KOH; terminal cells cylindric with rounded apices."
First Nature,Trametes versicolor,"Phylum: Basidiomycota - Class: Agaricomycetes - Order: Polyporales - Family: Polyporaceae
Distribution - Taxonomic History - Etymology - Identification - Culinary Notes - Reference Sources

Trametes versicolor, Turkeytail fungus (formerly known as the Many-Zoned Polypore) can be found all through the year, but it is most obvious in the winter months when deciduous trees are bare. This very variable fungus grows mainly on dead hardwood, including stumps and standing dead trees as well as fallen b"
Wikipedia,Trametes versicolor,"Trametes versicolor – also known as Coriolus versicolor and Polyporus versicolor – is a common polypore mushroom found throughout the world. Meaning 'of several colors', versicolor accurately describes this fungus that displays a unique blend of markings. Additionally, owing to its shape being similar to that of a wild turkey's tail feathers, T. versicolor is most commonly referred to as turkey tail. A similar-looking mushroom commonly called ""false turkey tail"" is from a different order (Stereu"
Mushroom Expert,Trametes versicolor,"Ecology:Saprobicon the deadwood of hardwoods, or rarely on the wood of conifers; annual; causing a white rot of the sapwood; growing in dense, overlapping clusters or rosettes on logs and stumps; year-round; very widely distributed and common in North America. The illustrated and described collections are from Illinois.
Cap: 2–8 cm across; 1–4 cm deep; 1–2 mm thick; plano-convex to flat; in outline circular, semicircular, fan-shaped, bracket-shaped, or kidney-shaped; often fused with other caps; flexible when fresh; densely hairy or velvety, often with alternating zones of texture; with concentric zones of white, gray, brown, cinnamon, orangish, and reddish brown (but highly variable in color and sometimes with other shades, including blue, green, and orange).
Pore Surface: Whitish to pale brownish; not bruising; with 3–6 or more tiny pores per mm; tubes up to 1.5 mm deep.
Flesh: Insubstantial; whitish, except for a very thin black line (in cross-section) separating the cap surface from the flesh; tough and leathery.
Odor and Taste: Not distinctive.
Chemical Reactions: KOH negative to yellowish or yellow on flesh.
Spore Print: Whitish.
Microscopic Features: Spores 4.5–5.5 x 1.5–2 µm; cylindric; smooth; hyaline in KOH; inamyloid. Basidia 18–20 x 3–4.5 µm; 4-spored; clamped. Cystidia not found. Hyphal system trimitic."
First Nature,Volvariella bombycina,"Phylum: Basidiomycota - Class: Agaricomycetes - Order: Agaricales - Family: Pluteaceae.
Distribution - Taxonomic History - Etymology - Identification - Culinary Notes - Reference Sources

This rare and striking silky-capped mushroom often emerges from knot holes and other damaged areas high up on standing trees. It is not parasitic, and even when seen on living trees it is invariably attached to dead wood.
The scarcity of this mushroom should be enough to convince anyone that this is not a speci"
Wikipedia,Volvariella bombycina,"Volvariella bombycina, commonly known as the silky volvariella, silky sheath, silky rosegill, silver-silk straw mushroom, or tree mushroom, is a species of edible mushroom in the family Pluteaceae.
The fruit body (mushroom) begins developing in a thin, egg-like sac. This ruptures and the stem expands quickly, leaving the sac at the base of the stem as a volva. The cap, which can attain a diameter of up to 20 centimetres (8 inches), is white to slightly yellowish and covered with silky hairs. On "
Mushroom Expert,Volvariella bombycina,"Ecology:Saprobicon the wood of various hardwoods, either on dead trees or from the wounds of living, standing trees in forests or urban areas; usually growing alone but sometimes growing gregariously; late spring, summer and fall; widely distributed in North America but much more common east of the Rocky Mountains (and in western areas usually appearing in urban settings on the wood of cultivated trees); also found Central America, the Caribbean, South America, Europe, and central Asia—and occasionally reported from Africa and Oceania. The illustrated and described collections are from Illinois and Louisiana.
Cap: 5–12 cm; oval to subconic at first, becoming bell-shaped to broadly convex or nearly flat; dry; covered with silky hairs; snow white when young and fresh, but the hairs often becoming yellowish to brownish in age, especially over the center; the margin not becoming lined.
Gills: Free from the stem; crowded; white at first, becoming pink.
Stem: 6–15 cm long; 1–2.5 cm thick; more or less equal, but usually tapering somewhat to apex; often curved in order to set the cap ""straight"" due to growth on standing trees; dry; fairly bald; white; without aring; the base encased in a thick, white to yellowish or brown, sack-likevolva.
Flesh: White; unchanging when sliced.
Odor and Taste: Not distinctive.
Chemical Reactions: KOH negative on cap surface.
Spore Print: Brownish pink.
Microscopic Features: Spores 6–9 x 3.5–5 µm; ellipsoid; smooth; thick-walled; yellowish in KOH; inamyloid. Pleurocystidia 50–70 x 15–25 µm; lageniform or occasionally ellipsoid to subglobose; thin-walled; smooth; hyaline in KOH. Cheilocystidia similar to pleurocystidia; 35–50 x 10–15 µm. Pileipellis a non-gelatinized cutis; elements 10–35 µm wide, aseptate, smooth, thin-walled; hyaline in KOH, gradually tapering to a rounded apex."
