Source,Name,Description
First Nature,Amanita muscaria,"Phylum: Basidiomycota - Class: Agaricomycetes - Order: Agaricales - Family: Amanitaceae
Distribution - Etymology - Taxonomic History - Psychoactivity - Mythology - Identification - Reference Sources

The Fly Agaric, Amanita muscaria, is a hallucinogen and must be considered poisonous. These attractive fungi often appear in groups and are a common sight in all kinds of woodlands.
Usually recurring in the same place for several years, Amanita muscaria is found frequently throughout the northern he"
Wikipedia,Amanita muscaria,"Amanita muscaria, commonly known as the fly agaric or fly amanita, is a basidiomycete of the genus Amanita. It is a large white-gilled, white-spotted, and usually red mushroom.
Despite its easily distinguishable features, A. muscaria is a fungus with several known variations, or subspecies. These subspecies are slightly different, some having yellow or white caps, but are all usually called fly agarics, most often recognizable by their notable white spots. Recent DNA fungi research, however, has"
First Nature,Artomyces pyxidatus,"The page you have requested does not exist, or it may have been renamed or moved...
...but we might still be able to help:
A message about this problem has been sent to the webmaster, and if we can fix it so that things go more smoothly in future then we certainly will. We are sorry for any inconvenience and grateful for your patience.
Email Us..."
Wikipedia,Artomyces pyxidatus,"Artomyces pyxidatus is a coral fungus that is commonly called crown coral or crown-tipped coral fungus. Its most characteristic feature is the crown-like shape of the tips of its branches. The epithet pyxidatus means ""box-like""—a reference to this shape."
Mushroom Expert,Artomyces pyxidatus,"Ecology:Saprobic; growing alone or gregariously on the dead wood of hardwoods (especially the wood ofaspens,tulip trees, willows, and maples); spring, summer, and fall; widely distributed in eastern North America, the Rocky Mountains, and Mexico, but absent or rare on the West Coast.
Fruiting Body: 4-13 cm high; 2-10 cm wide; repeatedly branched.
Branches: 1-5 mm thick; smooth; whitish to pale yellowish at first, sometimes darkening to pale tan or developing pinkish hues; tips crowned with a shallow depression and 3-6 points, colored like the branches or becoming brownish.
Base: 1-3 cm long; under 1 cm thick; whitish, pinkish or brownish; finely fuzzy.
Flesh: Whitish; fairly tough; pliable.
Odor and Taste: Odor not distinctive or ""faintly of newly dug potatoes"" (Phillips); taste mild or peppery-acrid.
Spore Print: White.
Chemical Reactions: Iron salts negative to grayish or brownish on branches and base.
Microscopic Features: Spores 4-5 x 2-3 µ; elliptical, with a tiny apiculus; very minutely pitted; amyloid. Basidia four-sterigmate; clavate. Cystidia up to 50 x 9 µ; variously shaped (fusoid, cylindric, capitate, fusoid-ventricose, clavate); often scarcely projecting. Gloeoplerous hyphae 5-8 µ wide; scattered in the subhymenium; occasionally rising to the hymenium to form gloeocystidia. Clamp connections present and easily demonstrated."
First Nature,Auricularia fuscosuccinea,"The page you have requested does not exist, or it may have been renamed or moved...
...but we might still be able to help:
A message about this problem has been sent to the webmaster, and if we can fix it so that things go more smoothly in future then we certainly will. We are sorry for any inconvenience and grateful for your patience.
Email Us..."
Wikipedia,Auricularia fuscosuccinea,Auricularia fuscosuccinea is a species of edible Auriculariales fungus. It was first described scientifically in 1842 by French mycologist Camille Montagne as a species of Exidia. Paul Christoph Hennings transferred it to Auricularia in 1893.
First Nature,Auricularia mesenterica,"Phylum: Basidiomycota - Class: Agaricomycetes - Order: Auriculariales - Family: Auriculariaceae
Distribution - Taxonomic History - Etymology - Identification - Culinary Notes - Reference Sources

Auricularia mesentericais mainly seen in summer and autumn. It occurs most commonly on dead elm trees and on fallen elm trunks and branches, and so was particularly common after Dutch elm disease had ravaged the elms of Britain and Europe during the second half of the 20th century.
The so-called Jelly F"
Wikipedia,Auricularia mesenterica,"Auricularia mesenterica, commonly known as the tripe fungus, is a species of fungus in the family Auriculariaceae. Basidiocarps (fruit bodies) are gelatinous and typically formed in coalescing tiers on stumps and logs. They are partly pileate, with hirsute, zoned caps, and partly resupinate, with smooth to wrinkled undersurfaces that spread over the wood. Auricularia mesenterica is a saprotroph on dead deciduous trees and shrubs. The species is restricted to Europe and Central Asia."
First Nature,Calocera cornea,"Phylum: Basidiomycota - Class: Dacrymycetes - Order: Dacrymycetales - Family: Dacrymycetaceae
Distribution - Taxonomic History - Etymology - Identification - Culinary Notes - Reference Sources

This unbranching (or only very rarely branching) jelly fungus, with tiny fruitbodies usually shorter than the thickness of a finger, can be seen on trunks and twigs of deciduous broadleaf trees.
Small Stagshorn looks rather like a club fungus; however, it is much less brittle and microscopic examination r"
Wikipedia,Calocera cornea,"Calocera cornea is a jelly fungus that grows on decaying wood. It is a member of the Dacrymycetales, an order of fungi characterized by their unique ""tuning fork"" basidia.
Its yellow, finger-like, tapering basidiocarps are somewhat gelatinous in texture. In typical specimens the basidiocarps become up to 3 mm in diameter, and 2 cm in height. The hymenium covers the sides of the basidiocarps, each basidium producing and forcibly discharging only two basidiospores.
It is inedible. Calocera viscosa"
Mushroom Expert,Calocera cornea,"Ecology:Saprobic; growing scattered to gregariously on the deadwood of hardwoods (especially oaks), usually on sticks up to about 2 inches in diameter; summer and fall; originally described from Germany; widely distributed in Europe, North America, Central America, South America, Asia, and Oceania. The illustrated and described collections are from Illinois and North Carolina.
Fruiting Body: Cylindric, with a rounded to sharpened apex; occasionally shallowly forked near the tip; to about 18 mm high and 2 mm thick; surface bald and slick, orange to orangish yellow; apex often shriveling and turning orangish brown with age; flesh firm but gelatinous, yellow; base with a tiny pad of whitemycelium.
Odor: Not distinctive.
Spore Print: Whitish.
Microscopic Features:Spores7–10 x 3–4 µm; allantoid; smooth; 0–1-septate; hyaline inKOH.Basidiaand probasidia Y-shaped; 25–40 x 2–4 µm.Clamp connectionsnot found."
First Nature,Cantharellus guyanensis,"The page you have requested does not exist, or it may have been renamed or moved...
...but we might still be able to help:
A message about this problem has been sent to the webmaster, and if we can fix it so that things go more smoothly in future then we certainly will. We are sorry for any inconvenience and grateful for your patience.
Email Us..."
Wikipedia,Cantharellus guyanensis,"Cantharellus guyanensis is a tropical South American species of mushroom-forming fungus in the chanterelle genus (Cantharellus), first described by Camille Montagne from French Guiana in 1854.
It has since also been found in Guyana, Suriname, Venezuela, and Brazil. The fruit bodies have a bright orange cap colour and occur in medium- to large-sized troops. C. guyanensis seems to prefer sand-rich soil and forms ectomycorrhiza with a putatively wide range of host trees and shrubs including Coccolo"
First Nature,Chlorociboria aeruginascens,"Phylum: Ascomycota - Class: Leotiomycetes - Order: Helotiales - Family: Insertae sedis (placement uncertain)
Distribution - Taxonomic History - Etymology - Identification - Reference Sources

The green-stained wood that is evidence of Green Elfcup, Chlorociboria aeruginascens, is a common sight, but the fruitbodies are seen only infrequently. This mainly winter-fruiting fungus is sometimes referred to as Green Cup fungus.
Wood infected with Chlorociboria fungi has long been used in such decorati"
Wikipedia,Chlorociboria aeruginascens,"Chlorociboria aeruginascens is a saprobic species of mushroom, commonly known as the blue stain, green elfcup or the green wood cup because of its characteristic small, green, saucer-shaped fruit bodies. Although the actual fruit bodies are infrequently seen, the green staining of wood caused by the fungus is more prevalent."
Mushroom Expert,Chlorociboria aeruginascens,"Ecology:Saprobicon well-decayed, barkless logs and sticks, including those of both hardwoods and conifers; evident as green-stained wood year-round, but the fruiting bodies typically appear in summer and fall; widely distributed in North America. The illustrated and described collections are from Ohio, Pennsylvania, and Québec.
Fruiting Body: Cup-shaped at first, becoming flattened or disc-shaped; 2-5 mm across; with a tiny stem (1-2 mm long) that may be central or somewhat off-center; upper surface bald, blue-green; undersurface similar.
Odor and Taste: Not distinctive.
Microscopic Features: Spores 6-8 x 1-2 µ; subfusiform to nearly cylindric; smooth; biguttulate with a small oil droplet near each end. Paraphyses filiform; 70-80 x 1 µ; apices subacute; hyaline. Terminal cells on excipular surface cylindric; often twisted or contorted; 1-1.5 µ wide; smooth."
First Nature,Chlorophyllum molybdites,"The page you have requested does not exist, or it may have been renamed or moved...
...but we might still be able to help:
A message about this problem has been sent to the webmaster, and if we can fix it so that things go more smoothly in future then we certainly will. We are sorry for any inconvenience and grateful for your patience.
Email Us..."
Wikipedia,Chlorophyllum molybdites,"Chlorophyllum molybdites, commonly known as the green-spored parasol, false parasol, green-spored lepiota and vomiter, is a widespread mushroom. Poisonous and producing severe gastrointestinal symptoms of vomiting and diarrhea, it is commonly confused with the shaggy parasol (Chlorophyllum rhacodes) or shaggy mane (Coprinus comatus), and is the most commonly misidentified poisonous mushroom in North America. Its large size and similarity to the edible parasol mushroom (Macrolepiota procera), as "
Mushroom Expert,Chlorophyllum molybdites,"Ecology:Saprobic; growing alone, scattered, or gregariously in lawns and meadows—often in troops orfairy rings; summer through fall; widely distributed in North America, but more common from the Great Plains eastward. The illustrated and described collections are from Illinois.
Cap: 10–22 cm; convex to spherical when young, becoming broadly convex or nearly flat in age; dry; bald in the button stage, but soon becoming scaly with brown to pinkish brown  or tan scales that are uplifted or flat, and concentrated near the center; surface underneath scales finely fibrillose, whitish to pale tan.
Gills: Free from the stem or slightly attached to it; crowded;short gillsfrequent; white when young, becoming grayish green to brownish green as the spores mature.
Stem: 8–20 cm long; 1.5–3 cm thick; tapered slightly to apex, and slightly enlarged toward base; dry; bald or very finely fibrillose; firm; white to brownish; discoloring slightly brown on handling; with a persisting, whitishringthat features a greenish to brownish lower edge.
Flesh: White throughout; not staining when sliced, or staining reddish brown to pale pinkish red in the base; thick.
Odor and Taste: Not distinctive.
Chemical Reactions:KOHnegative on cap surface.
Spore Print: Dull grayish green.
Microscopic Features:Spores9–13 x 6–9 µm; amygdaliform to ellipsoid; smooth; with a slightly truncated end; featuring a small (1 µm) pore; thick-walled; hyaline to faintly greenish inKOH;dextrinoid.Cheilocystidia40–55 x 10–15 µm; cylindric to subclavate or clavate; thin-walled; smooth; hyaline to brownish in KOH.Pleurocystidiaabsent.Pileipellisa trichoderm (center of cap, or scales) or cutis (whitish, fibrillose surface)."
First Nature,Clathrus columnatus,"The page you have requested does not exist, or it may have been renamed or moved...
...but we might still be able to help:
A message about this problem has been sent to the webmaster, and if we can fix it so that things go more smoothly in future then we certainly will. We are sorry for any inconvenience and grateful for your patience.
Email Us..."
Wikipedia,Clathrus columnatus,"Clathrus columnatus, commonly known as the column stinkhorn, is a saprobic species of basidiomycete fungus in the family Phallaceae. Similar to other stinkhorn fungi, the fruiting body, known as the receptaculum, starts out as a subterranean ""egg"" form. As the fungus develops, the receptaculum expands and erupts out of the protective volva, ultimately developing into mature structures characterized by two to five long vertical orange or red spongy columns, joined at the apex. The fully grown rec"
Mushroom Expert,Clathrus columnatus,"Ecology:Saprobic; growing alone or gregariously; often near woody debris (sometimes directly from stumps or living trees) in lawns, gardens, cultivated soil, and so on; spring through fall, or over winter in warm climates; distributed in North America from roughly Pennsylvania to the Gulf Coast and Mexico; also found in the Caribbean, Central America, and South America. The illustrated and described collections are from Arkansas, Florida, Illinois, Louisiana, Texas, and Virginia.
Immature Fruiting Body: Like a whitish ""egg"" 2–3 cm high; when sliced revealing the red to orange stinkhorn-to-be encased in a brownish gelatinous substance.
Mature Fruiting Body: 5–12 cm high; 2–4 cm wide; consisting of 3–5 column-like arms arising separately (not from a shared stem structure) and joined seamlessly at the apex; arms arising from a whitevolva; base attached to whiterhizomorphs.
Arms: Up to about 1 cm thick; more or less equal; sometimes becoming flattened on the outer edge; hollow; spongy and soft; finely pocketed; orange to red, fading to pinkish or pinkish orange or nearly yellow.
Volva: Sac-like, encasing the base of the fruiting body; white.
Spore Slime: Brown; produced on the inner edges of the arms near or just below the apex of the stinkhorn; malodorous.
Microscopic Features:Spores3.5–4.5 x 1.5–2 µm; subellipsoid to cylindric; smooth; hyaline to faintly yellowish inKOHandMelzer's reagent; walls not cyanophilic; often with one small droplet near each end. Sphaerocysts of the branch context 16–56 µm across; subglobose to irregular; smooth; walls 0.5–1 µm thick; hyaline in KOH.Volvalhyphaeinterwoven; occasionally branching; 2–8 µm wide; smooth; thin-walled; hyaline in KOH;clamp connectionsnot found."
First Nature,Clavaria fragilis,"Phylum: Basidiomycota - Class: Agaricomycetes - Order: Clavariales - Family: Clavariaceae
Distribution - Taxonomic History - Etymology - Identification - Culinary Notes - Reference Sources

Simple, unbranched clubs but often in bunches, like eels with their tails twisting upwards as they fight over a morsel buried in a riverbed, White Spindles is the most common of the many fairy clubs and corals that pop up in unimproved grassland. (Their worm-like appearance is reflected in the synonym Clavari"
Wikipedia,Clavaria fragilis,"Clavaria fragilis, commonly known as fairy fingers, white worm coral, or white spindles, is a species of fungus in the family Clavariaceae. It is synonymous with Clavaria vermicularis. The fungus is the type species of the genus Clavaria and is a typical member of the clavarioid or club fungi. It produces tubular, unbranched, white basidiocarps (fruit bodies) that typically grow in clusters. The fruit bodies can reach dimensions of 15 cm (6 in) tall by 0.5 cm (1⁄4 in) thick. There are several si"
First Nature,Clavaria zollingeri,"Phylum: Basidiomycota - Class: Agaricomycetes - Order: Agarcales - Family: Clavariaceae
Distribution - Taxonomic History - Etymology - Identification - Reference Sources

This beautiful violet coral-like fungus is found only very occasionally. The dichotomously branching fruitbodies can be up to 10cm tall and are initially violet but become dull grey-brown when old. It is an inedible species and is so rare that it should not be gathered except for important research.

Rare in Brtain and Ireland,"
Wikipedia,Clavaria zollingeri,"Clavaria zollingeri, commonly known as the violet coral or the magenta coral, is a widely distributed species of fungus. It produces striking tubular, purple to pinkish-violet fruit bodies that grow up to 10 cm (3.9 in) tall and 7 cm (2.8 in) wide. The extreme tips of the fragile, slender branches are usually rounded and brownish. A typical member of the clavarioid or club fungi, Clavaria zollingeri is saprobic, and so derives nutrients by breaking down organic matter. The fruit bodies are typic"
Mushroom Expert,Clavaria zollingeri,"Ecology:Saprobic; almost always found in moss under hardwoods; growing alone or in groups; summer and fall; eastern North America.
Fruiting Body: 2-10 cm high; individual elements usually sharing a common base, branching frequently or only occasionally, 2-6 mm wide; surface purple to pinkish purple, fading somewhat; tips rounded or irregular; base whitish.
Flesh: Brittle; purplish; thin.
Odor and Taste: Not distinctive or mildly radishlike.
Spore Print: White.
Chemical Reactions: Irons salts negative on all surfaces.
Microscopic Features: Spores 4-7 x 3-5.5 µ; ellipsoid; smooth; with an apiculus; inamyloid. Basidia clavate; 30-60 x 5-9 µ; 4-sterigmate; not basally clamped. Clamp connections absent."
First Nature,Coprinellus disseminatus,"Phylum: Basidiomycota - Class: Agaricomycetes - Order: Agaricales - Family: Psathyrellaceae
Distribution - Taxonomic History - Etymology - Identification - Culinary Notes - Reference Sources

The Fairy Inkcap, Coprinellus disseminatus, rarely ventures forth alone or even with just a few friends; more often it forms dense masses swarming over rotting tree stumps and roots.
These gregarious little fungi occur from early spring until the onset of winter, and they are at their most spectacular when"
Wikipedia,Coprinellus disseminatus,"Coprinellus disseminatus, formerly known as Coprinus disseminatus and commonly known as the fairy inkcap, fairy bonnet, or trooping crumble cap, is a species of agaric fungus in the family Psathyrellaceae. Unlike most other coprinoid mushrooms, C. disseminatus does not dissolve into black ink (deliquesce) in maturity. The species was given its current name in 1939 by Jakob Emanuel Lange."
Mushroom Expert,Coprinellus disseminatus,"Ecology:Saprobic, growing in clusters, often by the hundreds; on decaying wood, especially near the bases of stumps; spring, summer, and fall; widely distributed in North America.
Cap: Minute to 2 cm; oval when young, expanding to broadly convex or bell-shaped; when young almost white, with a brownish center--or grayish--darkening to grayish or grayish brown with a brownish center, paler towards the margin; smooth, or very finely granular/hairy when young; lined or grooved from the margin nearly to the center.
Gills: Attached to the stem or free from it; white at first, but soon gray, then blackish; not deliquescing (turning to black ""ink""); close or almost distant.
Stem: 1.5-4 cm long; 1-2 mm thick; equal; smooth; often curved; white; hollow.
Flesh: Very thin; fragile.
Odor and Taste: Not distinctive.
Spore Print: Black or blackish brown.
Microscopic Features: Spores 6.5-10 x 4-6 µ; elliptical; smooth; with a central pore. Basidia 4-sterigmate, surrounded by 4-6 brachybasidia. Cheilocystidia cylindric, to 70 x 15 «. Pleurocystidia absent. Pileipellis an epithelium with lageniform to subcapitate, thin-walled  pileocystidia up to 200 µ long. Veil elements as more or less globose sphaerocysts up to 40 µ across. Clamp connections absent."
First Nature,Cordyceps militaris,"Phylum: Ascomycota - Class: Sordariomycetes - Order: Hypocreales - Family: Cordycipitaceae
Distribution - Taxonomic History - Etymology - Identification - Culinary Notes - Reference Sources

The Scarlet Caterpillarclub is found mainly in grassland and on woodland edges but also occasionally pushing up through bare soil during late summer and autumn. Growing on underground pupae of moths, this ascomycete parasitises its host, turning it into a mushy mess and then pushing up through the turf as a"
Wikipedia,Cordyceps militaris,"Cordyceps militaris, commonly known as the caterpillar fungus, is a species of fungus in the family Cordycipitaceae, and the type species of the genus Cordyceps, which consists of hundreds of species. The species was originally described by Carl Linnaeus in 1753 as Clavaria militaris. Cordyceps militaris parasitizes insects and is used in traditional Chinese medicine and modern pharmaceuticals."
Mushroom Expert,Cordyceps militaris,"Ecology:Parasiticon buried larvae and pupae of insects (primarily moths and butterflies); growing alone or gregariously; summer and fall; widely distributed in North America but apparently more common east of the Rocky Mountains.
Fruiting Body: 2-8 cm long; up to about .5 cm wide; club-shaped, with the top wider than the base; the upper portion orange and pimply, the lower portion smooth and orange to pale orange, often curved; narrowing at the base and arising from the buried pupa or larva; flesh pale watery orange, with an outer cortex.
Microscopic Features:Peritheciaembedded in a layer of loosely interwoven cells; sometimes appearing half-embedded or superficial. Asci 300-510 x 3.5-5 µ, with caps 3.5-5 µ thick. Spores segmented and threadlike; breaking into elliptical segments 2-4.5 x 1-1.5 µ."
First Nature,Cyptotrama asprata,"The page you have requested does not exist, or it may have been renamed or moved...
...but we might still be able to help:
A message about this problem has been sent to the webmaster, and if we can fix it so that things go more smoothly in future then we certainly will. We are sorry for any inconvenience and grateful for your patience.
Email Us..."
Wikipedia,Cyptotrama asprata,"Cyptotrama asprata (alternatively spelled aspratum), commonly known as the golden-scruffy collybia or spiny woodknight  is a saprobic species of mushroom in the family Physalacriaceae. Widely distributed in tropical regions of the world, it is characterized by the bright orange to yellow cap that in young specimens is covered with tufts of fibrils resembling small spikes. This fungus has had a varied taxonomical history, having been placed in fourteen genera before finally settling in Cyptotrama"
Mushroom Expert,Cyptotrama asprata,"Ecology:Saprobic; growing scattered to gregariously on deadwood of hardwoods or conifers; summer, or over winter in warmer climates; widely distributed in eastern North America, and also reported from Texas and the Southwest. The illustrated and described collections are from Ohio and Québec.
Cap: 9-20 mm; convex, becoming broadly convex or nearly flat; dry; granular dusted when young, remaining granular or becoming nearly bald with age; bright yellow to orangish yellow or dull yellow, darkening to brownish yellow with age; the margin sometimes becoming widely lined at maturity; the disc sometimes becoming wrinkled or nearly reticulate with age.
Gills: Broadly attached to the stem or beginning to run down it; distant; white; short-gills occasional.
Stem: 10-40 mm long; 1-3 mm thick; more or less equal above, or tapering to base;  often with a slight basal swelling; finely granular; dry; colored like the cap, or more pale.
Flesh: Whitish to yellowish; not changing when sliced.
Odor and Taste: Not distinctive.
Chemical Reactions: KOH pink on cap surface.
Spore Print: White.
Microscopic Features: Spores 7-11 x 6-7 µ; limoniform to sublacrymoid; smooth; hyaline in KOH; not cyanophilic; inamyloid. Cheilocystidia cylindric to subfusiform, with subcapitate or merely rounded apices; thin-walled; hyaline in KOH; 35-85 x 5-10 µ. Pleurocystidia scattered; similar to cheilocystidia, or more widely fusiform. Lamellar trama divergent. Pileipellis hymeniform (a turf of clavate to pyriform elements); elements thin- or thick-walled, golden in KOH, interspersed with scattered fusiform pileocystidia."
First Nature,Dacryopinax spathularia,"The page you have requested does not exist, or it may have been renamed or moved...
...but we might still be able to help:
A message about this problem has been sent to the webmaster, and if we can fix it so that things go more smoothly in future then we certainly will. We are sorry for any inconvenience and grateful for your patience.
Email Us..."
Wikipedia,Dacryopinax spathularia,"Dacrymyces spathularia is a species of fungus in the family Dacrymycetaceae. Basidiocarps (fruit bodies) are gelatinous, frequently spathulate (spoon-shaped), and grow on wood, mainly in the tropics and subtropics. The fungus is edible and is commercially cultivated for use as an additive in the food industry."
First Nature,Geastrum pectinatum,"Phylum: Basidiomycota - Class: Agaricomycetes - Order: Geastrales - Family: Geastraceae
Distribution - Taxonomic History - Etymology - Identification - Culinary Notes - Reference Sources

The Beaked Earthstar (also referred to in some field guides as the Beret Earthstar) is rarely seen for two reasons: it is rare, and it is very easy to miss because it blends in so well with fallen leaves and other dead vegetation in coniferous or broadleaf woodland, which is where this earthstar generally occur"
